"Name","Lastname","Email","Medium","Phone","Bio","Artist Statement","Facebook","Instagram","Website","Website2","Sample Piece","Piece Title","Piece Size","Piece Medium","Photo","Artists (Item)","Artist (List)","ID","Created Date","Updated Date","Owner"
"Alisa H. Workman","Workman","ahworkmanart@gmail.com","[""Painting""]","1-937-654-6068","{""nodes"":[{""type"":""PARAGRAPH"",""id"":""foo"",""nodes"":[{""type"":""TEXT"",""id"":"""",""nodes"":[],""textData"":{""text"":""Alisa H. Workman has had a love for nature and gardening all of her life. As a young child, she remembers pulling the marigold blooms off of the flowers in her grandmother’s garden. She started out creating mosaic pots and birdbaths, painted garden pots, and other art installations for the garden. In the summer of 2015 she picked up a paintbrush and brought her love of flowers to the canvas."",""decorations"":[]}}],""paragraphData"":{""textStyle"":{""textAlignment"":""AUTO""},""indentation"":0}},{""type"":""PARAGRAPH"",""id"":""aktl6230"",""nodes"":[{""type"":""TEXT"",""id"":"""",""nodes"":[],""textData"":{""text"":""Alisa has been a Dayton, Ohio area resident most of her life. She is a graduate of Wright State University earning a BS in Geology with a specialty in Crystallography. Her career has included working in a bioacoustics lab and a 15 year stint as a stay-at-home mom. Since 1998 she has worked at The Miami Valley School and currently is a full time preschool art teacher at the Soin Early Childhood School at MVS."",""decorations"":[]}}],""paragraphData"":{""textStyle"":{""textAlignment"":""AUTO""}}},{""type"":""PARAGRAPH"",""id"":""dblrd232"",""nodes"":[{""type"":""TEXT"",""id"":"""",""nodes"":[],""textData"":{""text"":""Her paintings have been exhibited in the Dayton, Cincinnati, and Columbus areas of Ohio. Her work can be found in collections throughout the United States, Canada, and Europe."",""decorations"":[]}}],""paragraphData"":{""textStyle"":{""textAlignment"":""AUTO""}}},{""type"":""PARAGRAPH"",""id"":""zxzxm234"",""nodes"":[{""type"":""TEXT"",""id"":"""",""nodes"":[],""textData"":{""text"":""Her love of nature, art, and science are translated into acrylic paintings of bold flowers and vibrant splashes of color. Each and every painting tells a story."",""decorations"":[]}}],""paragraphData"":{""textStyle"":{""textAlignment"":""AUTO""}}}],""metadata"":{""version"":1,""createdTimestamp"":""2022-12-19T17:56:18.279Z"",""updatedTimestamp"":""2022-12-19T17:56:18.279Z"",""id"":""e74f5610-20ac-416c-97fa-766cfb10766a""},""documentStyle"":{}}","I dabbled at the edge of the art pool for years ... mixed media collages, painted garden pots, colorful tiled garden hardscape installations.
The work that I consider my first completed painting, my frightening leap into the deep end of the pool, is SURVIVE. It was done in 2017, in the first art workshop that I attended. It was begun a year after my mother's death and my sister's suicide. It was completed after my husband's cancer diagnosis.
Life is filled with happiness and sadness. I choose to focus on the sadness and to turn that darkness into something bright and wonderful and happy. Vibrant colors energize and excite. I LOVE color.
Inspired by all that surrounds me, I paint lightly abstract floral works ... renderings of bold flowers with rich splashes of color.","https://www.facebook.com/AHWorkmanArt","https://www.instagram.com/ahworkman","https://www.ahworkmanart.com",,"[{""description"":"""",""slug"":""648eff_1ba4cf1336cc49c7b756bab271629724~mv2.jpeg"",""alt"":"""",""src"":""wix:image://v1/648eff_1ba4cf1336cc49c7b756bab271629724~mv2.jpeg/2024%2520SheLikestoDrinkaBottledFrappuccinoEveryDyBeforeNoon48x24Mar2024.jpeg#originWidth=3795&originHeight=1854"",""title"":""2024 SheLikestoDrinkaBottledFrappuccinoEveryDyBeforeNoon48x24Mar2024.jpeg"",""type"":""image"",""settings"":{""width"":3795,""height"":1854,""focalPoint"":[0.5,0.5]}}]","She Likes to Drink a Bottled Frappuccino Every Day Before Noon","48""x24""x1.5""","Acrylic on Canvas","wix:image://v1/648eff_28014662b31f474e86e931386ef7e941~mv2.jpeg/Alisa%20photo%20copy%202.jpeg#originWidth=491&originHeight=515","/artist/alisa-h.-workman","/artists/","86fd276f-6cfe-40a5-8b07-81a535d4daed",2024-03-26T22:38:37Z,2024-03-28T22:05:07Z,"648eff38-1300-4400-b20a-ee65209af597"
"Beth Borchers","Borchers","bethannborchers@gmail.com","[""Painting""]","5133134378","{""nodes"":[{""type"":""PARAGRAPH"",""id"":""foo"",""nodes"":[{""type"":""TEXT"",""id"":"""",""nodes"":[],""textData"":{""text"":""If you gaze deep within each piece, you will be forever changed by the soul reaching artwork of Beth Borchers!"",""decorations"":[{""type"":""COLOR"",""colorData"":{""background"":""rgb(255, 255, 255)"",""foreground"":""rgb(71, 71, 71)""}}]}}],""paragraphData"":{""textStyle"":{""textAlignment"":""AUTO""},""indentation"":0}},{""type"":""PARAGRAPH"",""id"":""7fj7v126"",""nodes"":[],""paragraphData"":{""textStyle"":{""textAlignment"":""AUTO""},""indentation"":0}},{""type"":""PARAGRAPH"",""id"":""z7s8r129"",""nodes"":[{""type"":""TEXT"",""id"":"""",""nodes"":[],""textData"":{""text"":""From a young age, Beth's love for nature, drawing and belief in a world of magic was evident. These themes are reflected in her artwork. Beth's paintings are captivating and distinctive, each one telling a story, respective to each individual. Her style is original, abstract, and is meant to connect you to your heart."",""decorations"":[{""type"":""COLOR"",""colorData"":{""background"":""rgb(255, 255, 255)"",""foreground"":""rgb(71, 71, 71)""}}]}}],""paragraphData"":{""textStyle"":{""textAlignment"":""AUTO""},""indentation"":0}},{""type"":""PARAGRAPH"",""id"":""m4vuh135"",""nodes"":[],""paragraphData"":{""textStyle"":{""textAlignment"":""AUTO""},""indentation"":0}},{""type"":""PARAGRAPH"",""id"":""gcwh0139"",""nodes"":[{""type"":""TEXT"",""id"":"""",""nodes"":[],""textData"":{""text"":""Beth is a self-taught mixed media artist who has taken the art world by storm with her intense colors and bold, sometimes playful choices. She loves adding splashes, swirls and circles of color or metallic accents giving each piece another layer of interest and depth. You never know what you may see if you contemplate it long enough. That is the magic!"",""decorations"":[{""type"":""COLOR"",""colorData"":{""background"":""rgb(255, 255, 255)"",""foreground"":""rgb(71, 71, 71)""}}]}}],""paragraphData"":{""textStyle"":{""textAlignment"":""AUTO""},""indentation"":0}},{""type"":""PARAGRAPH"",""id"":""06ily147"",""nodes"":[],""paragraphData"":{""textStyle"":{""textAlignment"":""AUTO""},""indentation"":0}},{""type"":""PARAGRAPH"",""id"":""xf7i0152"",""nodes"":[{""type"":""TEXT"",""id"":"""",""nodes"":[],""textData"":{""text"":""Beth’s art is more than just visually stunning - it mirrors her deep understanding of the power of love, peace, and joy. She strives to create a stirring of emotion in all who view it. Her work reflects her life, her experiences, and the beauty she has chosen to see in the world around her."",""decorations"":[{""type"":""COLOR"",""colorData"":{""background"":""rgb(255, 255, 255)"",""foreground"":""rgb(71, 71, 71)""}}]}}],""paragraphData"":{""textStyle"":{""textAlignment"":""AUTO""},""indentation"":0}}],""metadata"":{""version"":1,""createdTimestamp"":""2022-12-19T17:56:18.279Z"",""updatedTimestamp"":""2022-12-19T17:56:18.279Z"",""id"":""b553fff7-e55b-451e-b5c6-e42b078f17b6""},""documentStyle"":{}}","Whether you are looking for a statement piece for your living room or a unique gift for a loved one, you are sure to find something that speaks to your heart and soul in my pieces. Custom orders are always welcome, most sizes can be accommodated.",,,"https://bethborchersart.carrd.co/",,"[{""description"":"""",""slug"":""648eff_459597569f8a4414bb7050ad833c631e~mv2.jpg"",""alt"":"""",""src"":""wix:image://v1/648eff_459597569f8a4414bb7050ad833c631e~mv2.jpg/_.jpg#originWidth=2641&originHeight=2653"",""title"":"""",""type"":""image"",""settings"":{""width"":2641,""height"":2653,""focalPoint"":[0.5,0.5]}}]","Lost in a Dream","22x22","Acrylic on Canvas","wix:image://v1/648eff_fe36979117a54ee98c5b6858ff68dd77~mv2.jpg/20221201_091929.jpg#originWidth=2457&originHeight=2552","/artist/beth-borchers","/artists/","8ebf28b2-463a-4b60-9db8-09fea2805760",2024-11-10T19:23:15Z,2024-11-22T23:37:38Z,"648eff38-1300-4400-b20a-ee65209af597"
"Amy Kollar Anderson","Anderson","aka@kollaranderson.com","[""Painting""]",,"{""nodes"":[{""type"":""PARAGRAPH"",""id"":""foo"",""nodes"":[{""type"":""TEXT"",""id"":"""",""nodes"":[],""textData"":{""text"":""Amy Kollar Anderson creates surreal narrative paintings inspired by natural forms, the decorative arts and her love of animals. Her work has been shown internationally and featured in the publication, Imagine the Imagination: New Visions of Surrealism. Anderson was awarded three of the ReImagining Works commissions for the Dayton Metro Library in 2014-17, a commission for the Miami Valley Hospital and the Woodbourne Centerville Library in 2018 and a Culture Works MCACD Artist Opportunity Grant in 2018 & 2020."",""decorations"":[]}}],""paragraphData"":{""textStyle"":{""textAlignment"":""AUTO""},""indentation"":0}},{""type"":""PARAGRAPH"",""id"":""gcs15667"",""nodes"":[{""type"":""TEXT"",""id"":"""",""nodes"":[],""textData"":{""text"":""She received her B.F.A. from The School of the Art Institute of Chicago, and a Master of Humanities, with a focus in Fine Arts, from Wright State University."",""decorations"":[]}}],""paragraphData"":{""textStyle"":{""textAlignment"":""AUTO""}}},{""type"":""PARAGRAPH"",""id"":""2b5ai669"",""nodes"":[{""type"":""TEXT"",""id"":"""",""nodes"":[],""textData"":{""text"":""Amy Kollar Anderson lives with her husband and their three cats in the birthplace of aviation, Dayton, Ohio. Until recently, she was the Gallery Coordinator for the Rosewood Gallery, but left that position to pursue her art career full-time."",""decorations"":[]}}],""paragraphData"":{""textStyle"":{""textAlignment"":""AUTO""}}}],""metadata"":{""version"":1,""createdTimestamp"":""2022-12-19T17:56:18.279Z"",""updatedTimestamp"":""2022-12-19T17:56:18.279Z"",""id"":""d72eb8d7-2c50-480f-a064-12224f0ab2c8""},""documentStyle"":{}}","Inspired by her sewing hobby and the thrift stores she frequents, Amy Kollar Anderson’s paintings pair patterns, textures and colors in unconventional ways. Using a panel base, she builds the painting surface with layers of Pouring Medium embedded with unique materials, such as glitter, mica, washi, and holographic/metallic foils. These layers also include areas of paint that she applies with her fingers or in puddles, allowing the material to drip and evaporate in unpredictable ways. These dense layers hover above each other with an effect similar to glass or resin, then she incorporates detailed narrative images. The narratives explore tension/anxiety, obsession, humor, and transformation. Her subject matter is influenced by the natural world and her environmental concerns, dreams, and personal experiences. She recently finished a 13 panel series inspired by the symbolism of the Zodiac constellations and is currently working on another 13 panel series focused on the Celtic Tree Zodiac.","https://www.facebook.com/AmyKollarAnderson/","https://www.instagram.com/amykollaranderson/","http://www.kollaranderson.com",,"[{""src"":""wix:image://v1/648eff_5b01fefeba274f3196e39d283c25b880~mv2.jpg/The_Den_KollarAnderson.jpg#originWidth=1200&originHeight=1200"",""type"":""image"",""title"":""The_Den_KollarAnderson.jpg"",""slug"":""648eff_5b01fefeba274f3196e39d283c25b880mv2.jpg""}]","The Den","14 x 14","Acrylic, glitter and pouring medium on panel","wix:image://v1/648eff_7cda163afd6a4edb863384145588047e~mv2.jpg/Studio_2023_small.jpg#originWidth=2000&originHeight=1501","/artist/amy-kollar-anderson","/artists/","90232992-d7ff-45c2-be5b-4f40635e837e",2024-03-08T01:25:13Z,2024-03-28T22:07:15Z,"648eff38-1300-4400-b20a-ee65209af597"
"Erica Keener","Keener","erica@ericakeenerart.com","[""Drawing"",""Painting""]",,"{""nodes"":[{""type"":""PARAGRAPH"",""id"":""foo"",""nodes"":[{""type"":""TEXT"",""id"":"""",""nodes"":[],""textData"":{""text"":""With her bold use of color and her eye for natural detail, Erica’s work captures the world around us, asking viewers to reconsider even the most apparently ordinary scenes. In particular she enjoys trying to recreate clouds and storms as they move over the landscape. Through her paintings, Erica’s hope is to share the sanctuary that she finds in nature, particularly when contemplating the ever changing skies above. She encourages everyone to look around more often - and especially to look up."",""decorations"":[]}}],""paragraphData"":{""textStyle"":{""textAlignment"":""AUTO""},""indentation"":0}},{""type"":""PARAGRAPH"",""id"":""5aimc231"",""nodes"":[{""type"":""TEXT"",""id"":"""",""nodes"":[],""textData"":{""text"":""Working from her own reference photos, many taken in the vicinity of her home in the country in Preble County, the tactile nature of her preferred medium of pastels allows Erica to directly interact with the source of inspiration, creating pieces that evoke a sense of wonder and awe at the beauty of the natural world."",""decorations"":[]}}],""paragraphData"":{""textStyle"":{""textAlignment"":""AUTO""}}},{""type"":""PARAGRAPH"",""id"":""11181237"",""nodes"":[],""paragraphData"":{""textStyle"":{""textAlignment"":""AUTO""}}},{""type"":""PARAGRAPH"",""id"":""tj85e233"",""nodes"":[{""type"":""TEXT"",""id"":"""",""nodes"":[],""textData"":{""text"":""She is privileged to be a member of the supportive art community in Dayton and has a studio at the Front Street Art complex. Her award winning art has been exhibited in Richmond, Oxford, Dayton and Cincinnati and can be found at the McCullough-Hyde Memorial Hospital in Oxford, the Henny Penny Corporate Headquarters in Eaton, the Five Rivers Health Center Edmonton Campus in Dayton as well as local private collections throughout the Miami Valley area and beyond."",""decorations"":[]}}],""paragraphData"":{""textStyle"":{""textAlignment"":""AUTO""}}}],""metadata"":{""version"":1,""createdTimestamp"":""2022-12-19T17:56:18.279Z"",""updatedTimestamp"":""2022-12-19T17:56:18.279Z"",""id"":""cb6cc9b9-a909-48bb-a3e9-372db9f93ba7""},""documentStyle"":{}}","I used to think of painting in solitary terms. It was simply straight-forward observation of light and shadow and color, capturing a fleeting moment on canvas or paper for my own satisfaction. But when others began to tell me about the joy my paintings brought to them, I realized it was more than that. It meant something. It was personal to them as well, it made them smile, gave them solace. What was on the surface just a painting of the sky or fields became a source of comfort and have come to realize that my little contribution to making the world a better place is to share with others the sanctuary that I have found when shadow and light and color come together in those fleeting moments of harmony. And maybe that small sanctuary in a chaotic world is not such a little thing after all.","https://www.facebook.com/ericakeenerart/","https://www.instagram.com/ericakeenerart/","https://www.ericakeenerart.com/contact",,"[{""description"":"""",""slug"":""648eff_ed751437fee84eed8a908a59270bb0a1~mv2.jpeg"",""alt"":"""",""src"":""wix:image://v1/648eff_ed751437fee84eed8a908a59270bb0a1~mv2.jpeg/Scattering%2520copy.jpeg#originWidth=4376&originHeight=2073"",""title"":""Scattering copy.jpeg"",""type"":""image"",""settings"":{""width"":4376,""height"":2073,""focalPoint"":[0.5,0.5]}}]","Scattering","12x24","Pastel","wix:image://v1/648eff_e99a77dc7c4d4751ad375a425f55d958~mv2.jpeg/IMG_8197.jpeg#originWidth=536&originHeight=650","/artist/erica-keener","/artists/","91299bde-ea60-4dac-9a6f-082466e38df6",2024-03-17T12:17:28Z,2024-03-28T22:05:36Z,"648eff38-1300-4400-b20a-ee65209af597"
"Gretchen Durst Jacobs","Jacobs","gretchendurstjacobs@gmail.com","[""Drawing"",""Painting"",""Printmaking""]","9376094225","{""nodes"":[{""type"":""PARAGRAPH"",""id"":""foo"",""nodes"":[{""type"":""TEXT"",""id"":"""",""nodes"":[],""textData"":{""text"":""Gretchen Durst Jacobs was born in Dayton, Ohio. She holds degrees in painting from Wright State University in Dayton, OH (BFA, 2000) and The University of Cincinnati, Cincinnati, OH (MFA, 2008). In 2000 and 2001, she attended The New York Studio School, Drawing and Painting Marathons. She received a Montgomery County Arts and Cultural District, Individual Artist Grant in 2023. Her work has been the subject of 9 solo exhibitions. She has shown extensively in Ohio, the US and Canada venues including Manifest Gallery, Cincinnati, OH (2023), The Lambton Heritage Museum, Ontario, Canada (2022) The Dana Wiley Gallery, Dayton, OH (2021), The University of Cincinnati (2018), Truro Center for the Arts at Castle Hill, (2020) Zea Mays, Florence, MA (2019) Morgan Conservatory, Cleveland, OH (2019) Alten Feuerwache Loschwitz, Grafikwerkstatt, Dresden, Germany (2018), Dayton/Kyoto Print Exchange, (2016, 2018, 2020, 2023), Ohio Northern University (2010). You can see her public art installed at The Dayton Metro Library (completed in 2017) and the Kettering Government Center (completed 2015). She is represented by The Dana Wiley Gallery, Dayton, Ohio."",""decorations"":[]}}],""paragraphData"":{""textStyle"":{""textAlignment"":""AUTO""},""indentation"":0}}],""metadata"":{""version"":1,""createdTimestamp"":""2022-12-19T17:56:18.279Z"",""updatedTimestamp"":""2022-12-19T17:56:18.279Z"",""id"":""af0e672b-10c7-493b-858b-7cc45604c972""},""documentStyle"":{}}","I create non-objective paintings informed by the scale of my body; most of my paintings are near my height and reach from fingertip to fingertip. I am fascinated by the qualities of color, movement, rhythm, and space. I work with themes such as the natural world, climate change, and feminist ideas. A limited and carefully considered color palette references the body/nature, psychological interior and power. Muscle memory informs my mark-making, aligning my perception and thoughts. Paint is applied intuitively and is expressive and tender, and in this, I embody the landscape.
A carefully designed grid is at the heart of each new painting. The grid forms a hard and soft boundary for the work and creates a mutable tension between the geometry and the interweaving large gesture. This pictorial dichotomy references the relational dualism at work in our modern lives and our environment.
The dominant canon of abstract painting has long been associated with masculinity, and so I reclaim this process as I wonder, what is feminine abstract painting? As a woman it is what I know. By utilizing all of my faculties, body and mind, I can best observe my subject of consequence—my enduring and sacred relationship with the natural world and its essential place in my life and work.",,"https://www.instagram.com/gretchendjacobs/","https://gretchendurstjacobs.com",,"[{""description"":"""",""slug"":""648eff_263896132a044a3987fd6ba79457ce9e~mv2.jpg"",""alt"":"""",""src"":""wix:image://v1/648eff_263896132a044a3987fd6ba79457ce9e~mv2.jpg/Gold%2520Rush.jpg#originWidth=2578&originHeight=3072"",""title"":""Gold Rush.jpg"",""type"":""image"",""settings"":{""width"":2578,""height"":3072,""focalPoint"":[0.5,0.5]}}]","Gold Rush","42""x50""","acrylic on paper mounted to panel","wix:image://v1/648eff_a5c03e9bf4ac40cc9b79d1d1d9329f1a~mv2.jpeg/IMG_4121.jpeg#originWidth=2316&originHeight=3088","/artist/gretchen-durst-jacobs","/artists/","92817f08-fec5-4fa8-85dc-865a19e2b1a0",2024-03-10T23:55:45Z,2024-03-28T22:06:39Z,"648eff38-1300-4400-b20a-ee65209af597"
"Lydia Williamson","Williamson","lydiawdesign@gmail.com","[""Drawing"",""Painting""]","5137557892","{""nodes"":[{""type"":""PARAGRAPH"",""id"":""foo"",""nodes"":[{""type"":""TEXT"",""id"":"""",""nodes"":[],""textData"":{""text"":""I’m Lydia Williamson, an acrylic and mixed media painter with a studio and gallery in Dayton, Ohio, which I opened three years ago with my dad. I’ve been a professional artist for five years, and my work revolves around my \""NOODLE People,\"" a series of exaggerated, long-limbed people that explore the humor and awkwardness of human experience. "",""decorations"":[{""type"":""COLOR"",""colorData"":{""background"":""rgb(255, 255, 255)"",""foreground"":""rgb(71, 71, 71)""}}]}}],""paragraphData"":{""textStyle"":{""textAlignment"":""AUTO""},""indentation"":0}},{""type"":""PARAGRAPH"",""id"":""zd2bg142"",""nodes"":[],""paragraphData"":{""textStyle"":{""textAlignment"":""AUTO""},""indentation"":0}},{""type"":""PARAGRAPH"",""id"":""lmcxs146"",""nodes"":[{""type"":""TEXT"",""id"":"""",""nodes"":[],""textData"":{""text"":""One of the most notable aspects of my artistic journey is the development of this distinct style, which has allowed me to create accessible, playful pieces that encourage viewers to project their own meaning onto them. What excites me most right now is experimenting with new ways to push the boundaries of these figures—exploring how abstract or surreal they can become while still inviting connection and curiosity."",""decorations"":[{""type"":""COLOR"",""colorData"":{""background"":""rgb(255, 255, 255)"",""foreground"":""rgb(71, 71, 71)""}}]}}],""paragraphData"":{""textStyle"":{""textAlignment"":""AUTO""},""indentation"":0}},{""type"":""PARAGRAPH"",""id"":""0js8z151"",""nodes"":[],""paragraphData"":{""textStyle"":{""textAlignment"":""AUTO""},""indentation"":0}},{""type"":""PARAGRAPH"",""id"":""9nvfu137"",""nodes"":[{""type"":""TEXT"",""id"":"""",""nodes"":[],""textData"":{""text"":""My creative practice is about freedom, spontaneity, and the joy of creating without rigid rules. Each piece is an adventure, and I’m always excited to see where the noodle people take me next."",""decorations"":[{""type"":""COLOR"",""colorData"":{""background"":""rgb(255, 255, 255)"",""foreground"":""rgb(71, 71, 71)""}}]}}],""paragraphData"":{""textStyle"":{""textAlignment"":""AUTO""},""indentation"":0}}],""metadata"":{""version"":1,""createdTimestamp"":""2022-12-19T17:56:18.279Z"",""updatedTimestamp"":""2022-12-19T17:56:18.279Z"",""id"":""46917798-eda1-436e-8148-64bf973cf5ea""},""documentStyle"":{}}","My artwork features ""Noodle People"" with elongated limbs, inviting viewers to explore the playful and open-ended nature of human expression.",,"https://www.instagram.com/lydianoodlegirl/",,,"[{""description"":"""",""slug"":""648eff_8ce2c9ab685041299a92d3386ba92eca~mv2.jpg"",""alt"":"""",""src"":""wix:image://v1/648eff_8ce2c9ab685041299a92d3386ba92eca~mv2.jpg/_.jpg#originWidth=3024&originHeight=4032"",""title"":"""",""type"":""image"",""settings"":{""width"":3024,""height"":4032,""focalPoint"":[0.5,0.5]}}]","My Studio Table",,"Mixed Media","wix:image://v1/648eff_f758bc7cbf10414fb1ad2ab02f6a0fcd~mv2.jpg/Lydia%20Williamson%20Face.jpg#originWidth=4672&originHeight=3648","/artist/lydia-williamson","/artists/","92d64cd9-f3de-4af2-9705-7aeb135cacc6",2024-10-29T23:37:42Z,2024-10-29T23:37:42Z,"648eff38-1300-4400-b20a-ee65209af597"
