"Name","Lastname","Email","Medium","Phone","Bio","Artist Statement","Facebook","Instagram","Website","Website2","Sample Piece","Piece Title","Piece Size","Piece Medium","Photo","Artists (Item)","Artist (List)","ID","Created Date","Updated Date","Owner"
"Shauna Schramke","Schramke","worthlessdogrebellion@gmail.com","[""Painting"",""Sculpture""]","6142712763","{""nodes"":[{""type"":""PARAGRAPH"",""id"":""foo"",""nodes"":[{""type"":""TEXT"",""id"":"""",""nodes"":[],""textData"":{""text"":""Shauna Schramke is a visual artist living with her wife and son in Urbana, Ohio. She is an educator, a fair to middling whistler and avid time traveler. She is keen on old, quirky homes and spends her moments painting them into timescapes and portals. Her houses are people – portraits of the introverted, the less popular, the lovely, the slightly off."",""decorations"":[]}}],""paragraphData"":{""textStyle"":{""textAlignment"":""AUTO""},""indentation"":0}}],""metadata"":{""version"":1,""createdTimestamp"":""2022-12-19T17:56:18.279Z"",""updatedTimestamp"":""2022-12-19T17:56:18.279Z"",""id"":""088e546c-b7d5-4ee9-b5d4-1d40ba3b0c39""},""documentStyle"":{}}","Give me painted wood and out of plumb foundations – a house with strong opinions and a tender heart. A home that refuses to let go – refuses to move on or move out of the way.","https://www.facebook.com/WDrebellion","https://www.instagram.com/wd_rebellion_studio?igsh=MmN2OTNxcXU3a2Rz","https://www.wdrebellion.com",,"[{""description"":"""",""slug"":""648eff_5cce21d8249d43da88ab6cdddc951407~mv2.jpg"",""alt"":"""",""src"":""wix:image://v1/648eff_5cce21d8249d43da88ab6cdddc951407~mv2.jpg/IMG_0762_edited.jpg#originWidth=1284&originHeight=1291"",""title"":""IMG_0762_edited.jpg"",""type"":""image"",""settings"":{""width"":1284,""height"":1291,""focalPoint"":[0.5,0.5]}}]","Choose Now","24” x 24” x 1.5”","Acrylic on canvas","wix:image://v1/648eff_a0ce7eb8621f4f21bd53baa8f1726301~mv2.jpg/IMG_0764_edited.jpg#originWidth=1284&originHeight=1718","/artist/shauna-schramke","/artists/","00a9748e-0425-486a-ac06-e332c2ac6f9a",2024-03-13T16:42:08Z,2024-03-28T22:06:08Z,"648eff38-1300-4400-b20a-ee65209af597"
"Emily von Stuckrad-Smolinski","Stuckrad","evonstuckrad@yahoo.com","[""Drawing"",""Painting"",""Fabric Arts"",""Photography""]","(937)603-9212","{""nodes"":[{""type"":""PARAGRAPH"",""id"":""foo"",""nodes"":[{""type"":""TEXT"",""id"":"""",""nodes"":[],""textData"":{""text"":""Emily von Stuckrad-Smolinski is a life-long Daytonian. Professionally, Emily has spent her career in the theatre downtown. When she is not backstage, she finds art to be her escape."",""decorations"":[]}}],""paragraphData"":{""textStyle"":{""textAlignment"":""AUTO""},""indentation"":0}}],""metadata"":{""version"":1,""createdTimestamp"":""2022-12-19T17:56:18.279Z"",""updatedTimestamp"":""2022-12-19T17:56:18.279Z"",""id"":""95146c84-3b3d-4b7f-b37e-b44658f064ec""},""documentStyle"":{}}","While there are many forms of creativity that have piqued my interest throughout life, oil painting has always been a returning comfort. There is nothing quite like opening a fresh tube of oil and imagining what it can bring to life on a white tundra.

My works find much of their character by using the material combined with technique to create a depth of texture unlike most. Choosing the touch of a finger, experimenting with a pallette knife or even an air compressor; these tools surpass any brush I have yet to find. Exploring past the expected boundaries, excites me as an artist and breathes energy into my pieces. The works come to life as the materials dictate the path each piece travels.

I often compare creating my paintings to running a long distance race. In the first leg, one must put miles behind them. The second leg brings a feeling of familiarity and comfort, finding my stride and feeling the excitement of the finish yet to come. The final leg is always the best and why I keep coming back. It is equivalent of “the runners high.” The stride has been found, the piece has come alive and with a touch, the race is through.","https://www.facebook.com/emilyvonsmo",,,,"[{""src"":""wix:image://v1/648eff_57bd0c7d3d04498c99adc6de2895fe13~mv2.jpg/von%20Stuckrad-Smolinski_Hand%20Picked.jpg#originWidth=2796&originHeight=2785"",""type"":""image"",""title"":""von Stuckrad-Smolinski_Hand Picked.jpg"",""slug"":""648eff_57bd0c7d3d04498c99adc6de2895fe13mv2.jpg""}]","Hand Picked","36""x36""","Mixed","wix:image://v1/648eff_57bd0c7d3d04498c99adc6de2895fe13~mv2.jpg/von%20Stuckrad-Smolinski_Hand%20Picked.jpg#originWidth=2796&originHeight=2785","/artist/emily-von-stuckrad-smolinski","/artists/","09b92080-6644-47b9-8a60-b3d8042e0c22",2024-03-08T01:31:46Z,2024-03-28T22:07:02Z,"648eff38-1300-4400-b20a-ee65209af597"
"David Leach","Leach","cdavidleach@gmail.com","[""Drawing"",""Printmaking"",""Painting""]","9378386322","{""nodes"":[{""type"":""PARAGRAPH"",""id"":""foo"",""nodes"":[{""type"":""TEXT"",""id"":"""",""nodes"":[],""textData"":{""text"":""David Leach was born in Evanston, Illinois, in 1946. He received a B.A. from Bucknell University, and an M.F.A. from Ohio University. He is an Emeritus Professor at Wright State University, having taught studio art there – primarily printmaking and drawing – from 1973 to 2003. He served as Chair of the Department of Art and Art History from 1985 to 1989. David has been a member of the Dayton Printmakers Cooperative for over 25 years. His drawings and prints have been published in conjunction with poetry and prose on numerous occasions, including Wanderers and Other Poems by Gary Pacernick (Prasada Press, 1985.) His work is in the collection of the Museum of Modern Art, the Beinicke Rare Book and Manuscript Library of Yale University, the Dayton Art Institute and the Cincinnati Museum of Art, among several other public and private collections."",""decorations"":[{""type"":""COLOR"",""colorData"":{""background"":""rgb(255, 255, 255)"",""foreground"":""rgb(71, 71, 71)""}}]}}],""paragraphData"":{""textStyle"":{""textAlignment"":""AUTO""},""indentation"":0}}],""documentStyle"":{}}","Over the past several years my work has developed around the simple theme of drawn lines.  As a whole, each drawing, print or painting proceeds from one line to the next.  Various motifs have evolved over time: flora/nature, memory, journey, maps, among them.  Most recently, these allusions, though abstract, have focused on landscape, architecture, and interior space.  This current direction, particularly the relationship between art and architecture, underscores a sense of art engaging with the community and the world we live in.","https://www.facebook.com/cdavidleach/","https://www.instagram.com/cdavidleach","https://davidleachart.com/",,"[{""description"":"""",""slug"":""648eff_faf1830f3deb42168187f44f15a401fe~mv2.jpg"",""alt"":"""",""src"":""wix:image://v1/648eff_faf1830f3deb42168187f44f15a401fe~mv2.jpg/_.jpg#originWidth=3044&originHeight=2040"",""title"":"""",""type"":""image"",""settings"":{""width"":3044,""height"":2040,""focalPoint"":[0.5,0.5]}}]","Horizon","28 x 40 in.","Drawing: ink, graphite, colored pencil, chalk and watercolor","wix:image://v1/648eff_28be4bdd1e3a4338a09b13e16afa9aa7~mv2.jpg/David%20Leach.jpg#originWidth=2302&originHeight=2534","/artist/david-leach","/artists/","0d9b0b34-b26e-4121-b705-589437fcd8e8",2025-03-17T23:15:59Z,2025-03-17T23:15:59Z,"648eff38-1300-4400-b20a-ee65209af597"
"Kurt Smolinski","Smolinski","evonstuckrad611@gmail.com","[""Drawing"",""Fabric Arts"",""Painting"",""Photography""]","(937)603-9212","{""nodes"":[{""type"":""PARAGRAPH"",""id"":""foo"",""nodes"":[{""type"":""TEXT"",""id"":"""",""nodes"":[],""textData"":{""text"":""Kurt attends a local middle school. When he is not pouring, you can find him playing tennis or pickleball."",""decorations"":[]}}],""paragraphData"":{""textStyle"":{""textAlignment"":""AUTO""},""indentation"":0}},{""type"":""PARAGRAPH"",""id"":""rjodh903"",""nodes"":[],""paragraphData"":{""textStyle"":{""textAlignment"":""AUTO""}}}],""metadata"":{""version"":1,""createdTimestamp"":""2022-12-19T17:56:18.279Z"",""updatedTimestamp"":""2022-12-19T17:56:18.279Z"",""id"":""e49a9069-863d-4619-ac97-d865e48696cd""},""documentStyle"":{}}","Kurt lets the colors guide him. His technique of pouring has come through much trial and error. Only the best sees it through!",,,,,"[{""src"":""wix:image://v1/648eff_04d6e51b834543aca16b70410fba7e2d~mv2.jpeg/IMG_1187.jpeg#originWidth=3024&originHeight=4032"",""type"":""image"",""title"":""IMG_1187.jpeg"",""slug"":""648eff_04d6e51b834543aca16b70410fba7e2dmv2.jpeg""}]","Resin Coaster","3""x3""","Resin","wix:image://v1/648eff_04d6e51b834543aca16b70410fba7e2d~mv2.jpeg/IMG_1187.jpeg#originWidth=3024&originHeight=4032","/artist/kurt-smolinski","/artists/","0e79364e-7593-4710-8c60-2733cf1ec726",2024-03-08T01:29:31Z,2024-03-28T22:07:09Z,"648eff38-1300-4400-b20a-ee65209af597"
"Linda Hart","Hart","lindahart230@gmail.com","[""Painting"",""Watercolor""]","(937)830-6868","{""nodes"":[{""type"":""PARAGRAPH"",""id"":""foo"",""nodes"":[{""type"":""TEXT"",""id"":"""",""nodes"":[],""textData"":{""text"":""Grants"",""decorations"":[{""type"":""BOLD"",""fontWeightValue"":700}]}}],""paragraphData"":{""textStyle"":{""textAlignment"":""AUTO""},""indentation"":0}},{""type"":""PARAGRAPH"",""id"":""q1i1g108"",""nodes"":[{""type"":""TEXT"",""id"":"""",""nodes"":[],""textData"":{""text"":""2022 Recipient of Culture Works Montgomery County Artist Opportunity Grant "",""decorations"":[]}}],""paragraphData"":{""textStyle"":{""textAlignment"":""AUTO""},""indentation"":0}},{""type"":""PARAGRAPH"",""id"":""9r089112"",""nodes"":[],""paragraphData"":{""textStyle"":{""textAlignment"":""AUTO""},""indentation"":0}},{""type"":""PARAGRAPH"",""id"":""rn9lf116"",""nodes"":[{""type"":""TEXT"",""id"":"""",""nodes"":[],""textData"":{""text"":""Solo Exhibitions"",""decorations"":[{""type"":""BOLD"",""fontWeightValue"":700}]}}],""paragraphData"":{""textStyle"":{""textAlignment"":""AUTO""},""indentation"":0}},{""type"":""PARAGRAPH"",""id"":""c4lev124"",""nodes"":[{""type"":""TEXT"",""id"":"""",""nodes"":[],""textData"":{""text"":""Indie West Studios – January- February 2024 "",""decorations"":[]}}],""paragraphData"":{""textStyle"":{""textAlignment"":""AUTO""},""indentation"":0}},{""type"":""PARAGRAPH"",""id"":""7byyf130"",""nodes"":[{""type"":""TEXT"",""id"":"""",""nodes"":[],""textData"":{""text"":""Chasing Urban Shadows- Front Street Experience Gallery – September 2022"",""decorations"":[]}}],""paragraphData"":{""textStyle"":{""textAlignment"":""AUTO""},""indentation"":0}},{""type"":""PARAGRAPH"",""id"":""ewnnc149"",""nodes"":[{""type"":""TEXT"",""id"":"""",""nodes"":[],""textData"":{""text"":""Centerville Police Department 2010 "",""decorations"":[]}}],""paragraphData"":{""textStyle"":{""textAlignment"":""AUTO""},""indentation"":0}},{""type"":""PARAGRAPH"",""id"":""pf759157"",""nodes"":[{""type"":""TEXT"",""id"":"""",""nodes"":[],""textData"":{""text"":""Christ United Methodist Church (Yearly Solo Gallery Exhibit 2005-2010 Month of February)"",""decorations"":[]}}],""paragraphData"":{""textStyle"":{""textAlignment"":""AUTO""},""indentation"":0}},{""type"":""PARAGRAPH"",""id"":""79crk173"",""nodes"":[{""type"":""TEXT"",""id"":"""",""nodes"":[],""textData"":{""text"":""Kettering Government Center October 2005 "",""decorations"":[]}}],""paragraphData"":{""textStyle"":{""textAlignment"":""AUTO""},""indentation"":0}},{""type"":""PARAGRAPH"",""id"":""yjkd3183"",""nodes"":[{""type"":""TEXT"",""id"":"""",""nodes"":[],""textData"":{""text"":""Aullwood Audubon Center October 2003 "",""decorations"":[]}}],""paragraphData"":{""textStyle"":{""textAlignment"":""AUTO""},""indentation"":0}},{""type"":""PARAGRAPH"",""id"":""d2hfy194"",""nodes"":[],""paragraphData"":{""textStyle"":{""textAlignment"":""AUTO""},""indentation"":0}},{""type"":""PARAGRAPH"",""id"":""kahnh217"",""nodes"":[{""type"":""TEXT"",""id"":"""",""nodes"":[],""textData"":{""text"":""Group Shows"",""decorations"":[{""type"":""BOLD"",""fontWeightValue"":700}]}}],""paragraphData"":{""textStyle"":{""textAlignment"":""AUTO""},""indentation"":0}},{""type"":""PARAGRAPH"",""id"":""rgnz8241"",""nodes"":[{""type"":""TEXT"",""id"":"""",""nodes"":[],""textData"":{""text"":""Germantown Public Library Juried Arts Exhibition December 2023-January 2024 "",""decorations"":[]}}],""paragraphData"":{""textStyle"":{""textAlignment"":""AUTO""},""indentation"":0}},{""type"":""PARAGRAPH"",""id"":""tewpf206"",""nodes"":[{""type"":""TEXT"",""id"":"""",""nodes"":[],""textData"":{""text"":""2023 Midwest Fall Showcase Women’s Spotlight Hilliard Arts Council - August-September 2023"",""decorations"":[]}}],""paragraphData"":{""textStyle"":{""textAlignment"":""AUTO""},""indentation"":0}},{""type"":""PARAGRAPH"",""id"":""l2blx282"",""nodes"":[{""type"":""TEXT"",""id"":"""",""nodes"":[],""textData"":{""text"":""Art in the City Juried Show 2023 "",""decorations"":[]}}],""paragraphData"":{""textStyle"":{""textAlignment"":""AUTO""},""indentation"":0}},{""type"":""PARAGRAPH"",""id"":""yww1y312"",""nodes"":[{""type"":""TEXT"",""id"":"""",""nodes"":[],""textData"":{""text"":""Life in the City Juried Show – Front Street 2023 "",""decorations"":[]}}],""paragraphData"":{""textStyle"":{""textAlignment"":""AUTO""},""indentation"":0}},{""type"":""PARAGRAPH"",""id"":""8k4hf328"",""nodes"":[{""type"":""TEXT"",""id"":"""",""nodes"":[],""textData"":{""text"":""ReMembered 2023 "",""decorations"":[]}}],""paragraphData"":{""textStyle"":{""textAlignment"":""AUTO""},""indentation"":0}},{""type"":""PARAGRAPH"",""id"":""tq0oj345"",""nodes"":[{""type"":""TEXT"",""id"":"""",""nodes"":[],""textData"":{""text"":""Annual Members Show Tipp City Arts Council 2023"",""decorations"":[]}}],""paragraphData"":{""textStyle"":{""textAlignment"":""AUTO""},""indentation"":0}},{""type"":""PARAGRAPH"",""id"":""fhvkf413"",""nodes"":[{""type"":""TEXT"",""id"":"""",""nodes"":[],""textData"":{""text"":""Fine Art Exhibit Inspire(d) Dayton Society of Artists 2023 Annual Spring Juried Exhibition"",""decorations"":[]}}],""paragraphData"":{""textStyle"":{""textAlignment"":""AUTO""},""indentation"":0}},{""type"":""PARAGRAPH"",""id"":""vqqn7468"",""nodes"":[{""type"":""TEXT"",""id"":"""",""nodes"":[],""textData"":{""text"":""Life in the City Juried Show- Front Street – August 2022"",""decorations"":[]}}],""paragraphData"":{""textStyle"":{""textAlignment"":""AUTO""},""indentation"":0}},{""type"":""PARAGRAPH"",""id"":""zwyxe506"",""nodes"":[{""type"":""TEXT"",""id"":"""",""nodes"":[],""textData"":{""text"":""Piqua Arts Council 29th Annual Fine Arts Exhibition 09/2021 "",""decorations"":[]}}],""paragraphData"":{""textStyle"":{""textAlignment"":""AUTO""},""indentation"":0}},{""type"":""PARAGRAPH"",""id"":""eq78b527"",""nodes"":[{""type"":""TEXT"",""id"":"""",""nodes"":[],""textData"":{""text"":""DVAC Annual Member’s Show - 2000- 2019"",""decorations"":[]}}],""paragraphData"":{""textStyle"":{""textAlignment"":""AUTO""},""indentation"":0}},{""type"":""PARAGRAPH"",""id"":""l08cb591"",""nodes"":[],""paragraphData"":{""textStyle"":{""textAlignment"":""AUTO""},""indentation"":0}},{""type"":""PARAGRAPH"",""id"":""lxjq0613"",""nodes"":[{""type"":""TEXT"",""id"":"""",""nodes"":[],""textData"":{""text"":""Awards"",""decorations"":[{""type"":""BOLD"",""fontWeightValue"":700}]}}],""paragraphData"":{""textStyle"":{""textAlignment"":""AUTO""},""indentation"":0}},{""type"":""PARAGRAPH"",""id"":""6zw6x657"",""nodes"":[{""type"":""TEXT"",""id"":"""",""nodes"":[],""textData"":{""text"":""Tipp City Arts Council 2023 Fine Art Exhibit- Second Place and Honorable Mention- Advanced Watermedia"",""decorations"":[]}}],""paragraphData"":{""textStyle"":{""textAlignment"":""AUTO""},""indentation"":0}},{""type"":""PARAGRAPH"",""id"":""w6wad884"",""nodes"":[{""type"":""TEXT"",""id"":"""",""nodes"":[],""textData"":{""text"":""Dayton Museum of Natural History Naturescape Show 1998 - Honorable Mention"",""decorations"":[]}}],""paragraphData"":{""textStyle"":{""textAlignment"":""AUTO""},""indentation"":0}},{""type"":""PARAGRAPH"",""id"":""a70de932"",""nodes"":[{""type"":""TEXT"",""id"":"""",""nodes"":[],""textData"":{""text"":""Dayton Society of Painters and Sculptors (Now DSA) – 1992 and 1993 Watercolor Category 2nd and 3rd place Awards "",""decorations"":[]}}],""paragraphData"":{""textStyle"":{""textAlignment"":""AUTO""},""indentation"":0}},{""type"":""PARAGRAPH"",""id"":""8fgta958"",""nodes"":[],""paragraphData"":{""textStyle"":{""textAlignment"":""AUTO""},""indentation"":0}},{""type"":""PARAGRAPH"",""id"":""cxb29984"",""nodes"":[{""type"":""TEXT"",""id"":"""",""nodes"":[],""textData"":{""text"":""Artists Organization Memberships"",""decorations"":[{""type"":""BOLD"",""fontWeightValue"":700}]}}],""paragraphData"":{""textStyle"":{""textAlignment"":""AUTO""},""indentation"":0}},{""type"":""PARAGRAPH"",""id"":""4mj2t1090"",""nodes"":[{""type"":""TEXT"",""id"":"""",""nodes"":[],""textData"":{""text"":""Dayton Society of Artists"",""decorations"":[]}}],""paragraphData"":{""textStyle"":{""textAlignment"":""AUTO""},""indentation"":0}},{""type"":""PARAGRAPH"",""id"":""7ymbn1144"",""nodes"":[{""type"":""TEXT"",""id"":"""",""nodes"":[],""textData"":{""text"":""The Contemporary- Dayton "",""decorations"":[]}}],""paragraphData"":{""textStyle"":{""textAlignment"":""AUTO""},""indentation"":0}},{""type"":""PARAGRAPH"",""id"":""jq87o1202"",""nodes"":[{""type"":""TEXT"",""id"":"""",""nodes"":[],""textData"":{""text"":""Silent Auction Artist for the past 20 years. "",""decorations"":[]}}],""paragraphData"":{""textStyle"":{""textAlignment"":""AUTO""},""indentation"":0}},{""type"":""PARAGRAPH"",""id"":""ujj3d1232"",""nodes"":[{""type"":""TEXT"",""id"":"""",""nodes"":[],""textData"":{""text"":""Live Auction Artist -2019"",""decorations"":[]}}],""paragraphData"":{""textStyle"":{""textAlignment"":""AUTO""},""indentation"":0}}],""metadata"":{""version"":1,""createdTimestamp"":""2022-12-19T17:56:18.279Z"",""updatedTimestamp"":""2022-12-19T17:56:18.279Z"",""id"":""7e5222e4-47c2-4f6c-aff2-5459fa47b62d""},""documentStyle"":{}}","In early 2021, Linda Hart began noticing the beauty in crumbling, decaying industrial warehouses and buildings in the Miami Valley and decided to challenge herself to do a body of work with subject matter she was unfamiliar with, to stretch her creativity and grow as an artist. She set out driving around East and West Dayton to take photos and found numerous industrial vignettes often with nature visibly taking over the structures or changing them in beautiful ways. She realized how perfect watercolor was to capture the beauty of the drips, rust, striations and textures of these decaying buildings. Chasing Urban Shadows was born from that urge to explore another path in her art. Linda saw the beauty in the decaying structures and wanted to bring that beauty to others’ attention with this body of work.
While still painting urban scenes, Linda still paints the natural world and the flowers and plants that inspire her.
About her work:
The more time I spent looking at deteriorating buildings in the backgrounds of our life in the Miami Valley, the more possibilities I saw for interesting and abstract paintings and was inspired to paint these scenes. I liked the way these images were actually some place real but also came across as an abstract image for your own interpretation. I found beauty in the decay, the same way I had previously found beauty in the flowers I have painted and grown for years. There is hidden beauty everywhere, even in industrial warehouses and train bridge overpasses and you must look a little harder to see it.
Will these aging industrial buildings become even more beautiful as they deteriorate more? I hope I inspire others to wonder about the same things while enjoying the images I have painted. I hope I have brought the beauty of what time and nature has done to these buildings to life and others love what they have become as they have evolved in their surroundings.""
Linda continues to paint the beauty of industrial Dayton but also has returned to her roots and brings flowers to life on canvas and clayboard in her Floral Auras series. Growing up at a nursery in Southwestern Pennsylvania instilled the beauty of nature and flowers for Linda at an early age. As a lifelong artist and gardener, she grows much of her subject matter. Moonflowers, bright yellow sunflowers and zinnias grown in her own yard are just some of the inspiration for her subject matter. This series embodies her life experiences as a gardener and an artist as she explores the inherent and ethereal beauty nature provides.","https://www.facebook.com/lindahart230","https://www.instagram.com/linda.hart.artist","https://artbylindahart.com",,"[{""description"":"""",""slug"":""648eff_0b98e2c45b2748b0aed0d7f0349c19ae~mv2.jpg"",""alt"":"""",""src"":""wix:image://v1/648eff_0b98e2c45b2748b0aed0d7f0349c19ae~mv2.jpg/Deconstructed%2520Sunflowers%2520and%2520Love%2520in%2520the%2520Mist.jpg#originWidth=2196&originHeight=1643"",""title"":""Deconstructed Sunflowers and Love in the Mist.jpg"",""type"":""image"",""settings"":{""width"":2196,""height"":1643,""focalPoint"":[0.5,0.5]}},{""description"":"""",""slug"":""648eff_a13cdae634a440f5b735642ad068910d~mv2.jpg"",""alt"":"""",""src"":""wix:image://v1/648eff_a13cdae634a440f5b735642ad068910d~mv2.jpg/unnamed.jpg#originWidth=1497&originHeight=1000"",""title"":""unnamed.jpg"",""type"":""image"",""settings"":{""width"":1497,""height"":1000,""focalPoint"":[0.5,0.5]}}]","Deconstructed Sunflowers and Love in the Mist","36"" x 48"" x 1.5""","Mixed Media- Watercolor and ink on Gallery Wrapped Canvas","wix:image://v1/648eff_2bd886ddf6c74f919ace2b48ee063640~mv2.jpg/linda%20hart%20profile.jpg#originWidth=1194&originHeight=1203","/artist/linda-hart","/artists/","140428ab-8af3-40bc-b443-cc7710ced7ad",2024-03-09T14:14:10Z,2024-03-28T22:06:51Z,"648eff38-1300-4400-b20a-ee65209af597"
