"Name","Lastname","Email","Medium","Phone","Bio","Artist Statement","Facebook","Instagram","Website","Website2","Sample Piece","Piece Title","Piece Size","Piece Medium","Photo","Artists (Item)","Artist (List)","ID","Created Date","Updated Date","Owner"
"Cindy Callahan","Callahan","beadlady3@yahoo.com","[""Painting""]","9373614861","{""nodes"":[{""type"":""PARAGRAPH"",""id"":""foo"",""nodes"":[{""type"":""TEXT"",""id"":"""",""nodes"":[],""textData"":{""text"":""Cindy is a native Daytonian and self-taught artist. She has taken workshops from local artists and online paid instruction. Her art has been featured at smaller gallery spaces downtown, as well as Front Street Art Fests. She is an active member of Dayton Society of Artists and Women’s TriArt Society."",""decorations"":[]}}],""paragraphData"":{""textStyle"":{""textAlignment"":""AUTO""},""indentation"":0}}],""metadata"":{""version"":1,""createdTimestamp"":""2022-12-19T17:56:18.279Z"",""updatedTimestamp"":""2022-12-19T17:56:18.279Z"",""id"":""e0126fc4-5550-421b-813f-8f079b02a844""},""documentStyle"":{}}","I am a prolific painter in both acrylic and watercolor. With acrylics my work celebrates the relationship of color, form, and texture. I work with a variety of texture making mediums, tools, and recycled objects to create depth and feeling.",,"https://artbycindyc.instagram.com",,,"[{""description"":"""",""slug"":""648eff_fc58d8f6cee14cd8a680df8cb23b195e~mv2.jpeg"",""alt"":"""",""src"":""wix:image://v1/648eff_fc58d8f6cee14cd8a680df8cb23b195e~mv2.jpeg/IMG_1478%2520(1).jpeg#originWidth=3024&originHeight=4032"",""title"":""IMG_1478 (1).jpeg"",""type"":""image"",""settings"":{""width"":3024,""height"":4032,""focalPoint"":[0.5,0.5]}}]","Circles in the Sand","14x18","Acrylics","wix:image://v1/648eff_7fc4562a37fd4051a8c0e8ded56fd529~mv2.jpg/IMG_1163_edited.jpg#originWidth=1242&originHeight=1238","/artist/cindy-callahan","/artists/","3767b5e0-46f7-4a27-899b-6639cb304414",2024-03-14T00:30:15Z,2024-03-28T22:05:54Z,"648eff38-1300-4400-b20a-ee65209af597"
"Francis Trick","Trick","fjt072@gmail.com","[""Painting"",""Jewelry""]","5132882749","{""nodes"":[{""type"":""PARAGRAPH"",""id"":""fthat200"",""nodes"":[{""type"":""TEXT"",""id"":"""",""nodes"":[],""textData"":{""text"":""Art....my rediscovered passion. I started college as an art major but switched to marketing graduating with a B.S. I have spent the my life in retail in one form or another, 26.5 years spent at The Home Depot with the last 18 years as a flooring specialist. "",""decorations"":[]}}],""paragraphData"":{}},{""type"":""PARAGRAPH"",""id"":""euwhy202"",""nodes"":[{""type"":""TEXT"",""id"":"""",""nodes"":[],""textData"":{""text"":""As an artist I have recently received 1st place recognition in The Dayton Society of Artists Peace Accords Show. I also was given a Judges Merit Award by fellow members of The Fairborn Art Association's members juried show."",""decorations"":[]}}],""paragraphData"":{}}],""documentStyle"":{}}","As a retired individual and after dabbling all my life in art, I have rediscovered my passion. With some research I have discovered Fluid/Liquid Acrylic Art. I am fascinated by the techniques and the beauty that happens when adding only a few colors to the canvas and then manipulating them in their liquid form.","https://www.facebook.com/share/19xhvfYjHe/","https://www.instagram.com/fjt072/profilecard/?igsh=MXRqZDVoaGhkYnp5Ng==",,,"[{""description"":"""",""fileName"":""inbound3512115212715992283.jpg"",""slug"":""648eff_16c22905fbf04c3ea9e6abb49dbc90c0~mv2.jpg"",""alt"":"""",""src"":""wix:image://v1/648eff_16c22905fbf04c3ea9e6abb49dbc90c0~mv2.jpg/inbound3512115212715992283.jpg#originWidth=3024&originHeight=4032"",""title"":""inbound3512115212715992283.jpg"",""type"":""image"",""settings"":{""width"":3024,""height"":4032,""focalPoint"":[0.5,0.5]}}]","Purple Mountain Majesty","12x16","Acrylic","wix:image://v1/648eff_e494169d80df466eb1b84380ee3fa33c~mv2.jpg/1737228862359611886035207162290.jpg#originWidth=1080&originHeight=1440","/artist/francis-trick","/artists/","3e8f0604-5b2f-4a99-97f9-ebf40fa56684",2025-07-01T21:33:32Z,2025-12-14T22:35:35Z,"648eff38-1300-4400-b20a-ee65209af597"
"Lori Daugherty","Daugherty","lori@dartyart.com","[""Painting""]","937-554-2732","{""nodes"":[{""type"":""PARAGRAPH"",""id"":""foo"",""nodes"":[{""type"":""TEXT"",""id"":"""",""nodes"":[],""textData"":{""text"":""Dayton-based abstract artist, Lori Daugherty, enjoys exploring and experimenting with the encaustic medium. She finds that the encaustic medium provides a wealth of depth, breadth, and texture, with an added twist of mystery."",""decorations"":[]}}],""paragraphData"":{""textStyle"":{""textAlignment"":""AUTO""},""indentation"":0}},{""type"":""PARAGRAPH"",""id"":""lm5ef111"",""nodes"":[],""paragraphData"":{""textStyle"":{""textAlignment"":""AUTO""},""indentation"":0}},{""type"":""PARAGRAPH"",""id"":""rshzq102"",""nodes"":[{""type"":""TEXT"",""id"":"""",""nodes"":[],""textData"":{""text"":""Armed with an arsenal of torches, hot plates, and air compressors Lori melds intricate layers of color with encaustic wax paints, inks, and shellac. She desires to take the viewer on an enchanted adventure while following the painting’s path, embracing the lines, the shapes, the color, and the texture."",""decorations"":[]}}],""paragraphData"":{""textStyle"":{""textAlignment"":""AUTO""}}},{""type"":""PARAGRAPH"",""id"":""r8hnr104"",""nodes"":[],""paragraphData"":{""textStyle"":{""textAlignment"":""AUTO""}}},{""type"":""PARAGRAPH"",""id"":""v5krh159"",""nodes"":[{""type"":""TEXT"",""id"":"""",""nodes"":[],""textData"":{""text"":""Lori has been involved in numerous local shows as well as large exhibitions throughout Ohio. Additionally, she is a member of The Contemporary - Dayton, The Dayton Society of Artists, and The Springfield Museum of Art - Ohio. As a passionate advocate for the local arts scene, she actively participates in various local art committees and projects."",""decorations"":[]}}],""paragraphData"":{""textStyle"":{""textAlignment"":""AUTO""}}},{""type"":""PARAGRAPH"",""id"":""8mtgy119"",""nodes"":[],""paragraphData"":{""textStyle"":{""textAlignment"":""AUTO""}}},{""type"":""PARAGRAPH"",""id"":""8cvjv106"",""nodes"":[{""type"":""TEXT"",""id"":"""",""nodes"":[],""textData"":{""text"":""Lori's artwork is featured in both private and commercial collections across various states in the US including Ohio, Kentucky, Tennessee, New York, Connecticut, Colorado, and Florida, extending its reach to California and even overseas in China."",""decorations"":[]}}],""paragraphData"":{""textStyle"":{""textAlignment"":""AUTO""}}},{""type"":""PARAGRAPH"",""id"":""snsxc126"",""nodes"":[],""paragraphData"":{""textStyle"":{""textAlignment"":""AUTO""}}},{""type"":""PARAGRAPH"",""id"":""lai54108"",""nodes"":[{""type"":""TEXT"",""id"":"""",""nodes"":[],""textData"":{""text"":""Lori’s studio/gallery called “Darty Art” can be found at the Front Street Buildings, which is one of Ohio’s largest art venues devoted to artist studios, art galleries, boutiques, and creative spaces. Lori welcomes the public to visit “Darty Art” during The Front Street’s First Friday and Third Sunday events of each month, or by appointment."",""decorations"":[]}}],""paragraphData"":{""textStyle"":{""textAlignment"":""AUTO""}}}],""metadata"":{""version"":1,""createdTimestamp"":""2022-12-19T17:56:18.279Z"",""updatedTimestamp"":""2022-12-19T17:56:18.279Z"",""id"":""00da5bd2-1b94-4f4c-9cba-97591dbce443""},""documentStyle"":{}}","Inspired by a vivid imagination and a fascination with color, texture, and motion, my art frequently captures brief moments that have caught my attention. I'm known for my bold, colorful, and lively abstract creations. Captivated by the process, I create intricate layers of color using wax, pigment, ink, shellac, and various other mediums. As an artist, my goal is to immerse the viewer into the intricate journey of each painting, by exploring its depths and complexities.","https://www.facebook.com/dartyartdayton","https://www.instagram.com/dartyartdayton/","https://www.dartyart.com/",,"[{""description"":"""",""slug"":""648eff_fd0fe787dc53496ab1b3c60bf78ec351~mv2.jpg"",""alt"":"""",""src"":""wix:image://v1/648eff_fd0fe787dc53496ab1b3c60bf78ec351~mv2.jpg/Its%2520a%2520Swell%2520Life.JPG.jpg#originWidth=1200&originHeight=1200"",""title"":""Its a Swell Life.JPG.jpg"",""type"":""image"",""settings"":{""width"":1200,""height"":1200,""focalPoint"":[0.5,0.5]}}]","It's a Swell Life","24’ x 24” x 2.5”","Encaustic Mixed Media on Birch Panel","wix:image://v1/648eff_19c240f4f8174166a6e7675d47280861~mv2.jpg/OV-4.jpg#originWidth=1800&originHeight=1200","/artist/lori-daugherty","/artists/","3f7030c6-dbf1-42a1-881a-12b09b1ac4a8",2024-03-13T00:27:10Z,2024-03-28T22:06:28Z,"648eff38-1300-4400-b20a-ee65209af597"
"Pat McClelland","McClelland","studiomcc@woh.rr.com","[""Drawing"",""Painting"",""Printmaking""]","937 902 1585","{""nodes"":[{""type"":""PARAGRAPH"",""id"":""foo"",""nodes"":[{""type"":""TEXT"",""id"":"""",""nodes"":[],""textData"":{""text"":""C. Pat McClelland"",""decorations"":[]}}],""paragraphData"":{""textStyle"":{""textAlignment"":""AUTO""},""indentation"":0}},{""type"":""PARAGRAPH"",""id"":""ds64e113"",""nodes"":[{""type"":""TEXT"",""id"":"""",""nodes"":[],""textData"":{""text"":""Born in Dayton, Ohio in 1952. Graduated from Wright State University in 1989, BFA with concentrations in painting and printmaking. Received a MFA from The University of Cincinnati in 1992 with a concentration in printmaking. Retired in 2020 from the position of Gallery Coordinator/Collections Curator at Sinclair Community College."",""decorations"":[]}}],""paragraphData"":{""textStyle"":{""textAlignment"":""AUTO""}}},{""type"":""PARAGRAPH"",""id"":""gub2n115"",""nodes"":[{""type"":""TEXT"",""id"":"""",""nodes"":[],""textData"":{""text"":""Has taught drawing, painting or printmaking at The University of Cincinnati, Wright State University, Antioch College, Central State University, The Dayton Art Institute, Rosewood Arts Center, and Sinclair Community College."",""decorations"":[]}}],""paragraphData"":{""textStyle"":{""textAlignment"":""AUTO""}}},{""type"":""PARAGRAPH"",""id"":""12dyx117"",""nodes"":[{""type"":""TEXT"",""id"":"""",""nodes"":[],""textData"":{""text"":""In 2011 was presented Wright State University, Department of Art and Art History, outstanding alum award."",""decorations"":[]}}],""paragraphData"":{""textStyle"":{""textAlignment"":""AUTO""}}},{""type"":""PARAGRAPH"",""id"":""z4ge7119"",""nodes"":[{""type"":""TEXT"",""id"":"""",""nodes"":[],""textData"":{""text"":""An active, exhibiting artist with work in many public and private collections including The University of Cincinnati, Sinclair Community College, Indiana University East, Children’s Medical Center - Dayton, and The Montgomery County Office of Management and Budget."",""decorations"":[]}}],""paragraphData"":{""textStyle"":{""textAlignment"":""AUTO""}}}],""metadata"":{""version"":1,""createdTimestamp"":""2022-12-19T17:56:18.279Z"",""updatedTimestamp"":""2022-12-19T17:56:18.279Z"",""id"":""6d35e88b-4579-4b74-abda-ef656d71f6d8""},""documentStyle"":{}}","Many people think of mathematics and fine art as being polar opposites: formulaic calculation verses creative intuition. When a friend recently asked me a question about art, I think I created more confusion than clarity when I replied that, ultimately, it was about math: wave lengths of light, Fibonacci number sequences, ratios, etc… Art can be understood by its mathematical properties. Fortunately for those of us who do not think in numbers, appreciation does not require understanding.

Life is complex. In an effort to respond to its infinite complexities, many people formulate simplicity by analyzing it in base-2 terms: good/bad, yes/no, male/female, us/them, yin/yang…

My recent work, though complex upon completion, is actually derived from the exploration of a multitude of base-2 relationships: warm/cool, order/chaos, shape/line, reading/looking, formal/narrative, illusionistic space/acknowledgement of surface… As the work develops these concepts merge, overlap, compete, and synthesize into a dynamic visual amalgamation that presents as complexity, but is essentially the result of simple, direct dialogue between prescribed elements. The most challenging aspect of this process for me, the artist, is to manage these conversations and be willing to sacrifice early developments of the composition in favor of newer strata of alteration as the painting progresses. Loss and discovery yield completion.",,,,,"[{""description"":"""",""slug"":""648eff_2b108cc2e37f4934b7514deb395eabe5~mv2.jpg"",""alt"":"""",""src"":""wix:image://v1/648eff_2b108cc2e37f4934b7514deb395eabe5~mv2.jpg/Decending%2520A%2520One%2520Day%2520Apron.JPG.jpg#originWidth=2817&originHeight=3403"",""title"":""Decending A One Day Apron.JPG.jpg"",""type"":""image"",""settings"":{""width"":2817,""height"":3403,""focalPoint"":[0.5,0.5]}}]","Decending A One Day Apron","55 x 44","acrylic on canvas","wix:image://v1/648eff_f48c8469f9214abd9c27864ea5743387~mv2.jpg/Pat.JPG.jpg#originWidth=2084&originHeight=1829","/artist/pat-mcclelland","/artists/","44ebf012-acd8-4f06-8268-29f41b641a5e",2024-04-02T14:04:13Z,2024-04-02T14:04:13Z,"648eff38-1300-4400-b20a-ee65209af597"
"Barbara Mandell","Mandell","barbmandell18@gmail.com","[""Drawing"",""Painting"",""Jewelry"",""Poetry"",""Fabric Arts"",""Photography"",""Flower Arrangement""]","513 226 8040","{""nodes"":[{""type"":""PARAGRAPH"",""id"":""foo"",""nodes"":[{""type"":""TEXT"",""id"":"""",""nodes"":[],""textData"":{""text"":""Barb Mandell has been creating art for over 47 years. Exhibitions in Ohio galleries, hotels, college and in private venues to raise capital campaign funds for non-profit charitable organizations."",""decorations"":[{""type"":""COLOR"",""colorData"":{""background"":""rgb(255, 255, 255)"",""foreground"":""rgb(80, 0, 80)""}}]}}],""paragraphData"":{""textStyle"":{""textAlignment"":""AUTO""},""indentation"":0}}],""metadata"":{""version"":1,""createdTimestamp"":""2022-12-19T17:56:18.279Z"",""updatedTimestamp"":""2022-12-19T17:56:18.279Z"",""id"":""f8cc6820-0092-4bc2-8f2e-92700f614129""},""documentStyle"":{}}","Barbara Mandell creates original designs by hand utilizing various mediums.

My interest in Impressionism, abstract, architectural lines, geometric shapes and balance of color strongly influences my work.  The art is designed to be colorful, imaginative, and a fun addition to your art collection for your home, business or industry.

A percentage of all my art sales go to Multiple Sclerosis and Breast Cancer Research.",,,,,"[{""description"":"""",""slug"":""648eff_a9d9f60500c74a898085741943fdb11f~mv2.jpg"",""alt"":"""",""src"":""wix:image://v1/648eff_a9d9f60500c74a898085741943fdb11f~mv2.jpg/IMG_0348.jpg#originWidth=3264&originHeight=2448"",""title"":""IMG_0348.jpg"",""type"":""image"",""settings"":{""width"":3264,""height"":2448,""focalPoint"":[0.5,0.5]}}]",,,,"wix:image://v1/648eff_410fd58eefc740138bd10fa411f37403~mv2.jpeg/image8.JPEG#originWidth=960&originHeight=1280","/artist/barbara-mandell","/artists/","46dda33d-acd4-4645-acba-43cbc22c6d7a",2024-05-01T13:00:13Z,2024-05-27T14:19:37Z,"648eff38-1300-4400-b20a-ee65209af597"
"Lindsey Tribelhorn","Tribelhorn","lindseytribelhorn@gmail.com","[""Drawing"",""Fabric Arts"",""Painting"",""Printmaking"",""Sculpture""]","9376898915","{""nodes"":[{""type"":""PARAGRAPH"",""id"":""foo"",""nodes"":[{""type"":""TEXT"",""id"":"""",""nodes"":[],""textData"":{""text"":""I am a mostly self taught artist who has lived and worked in the Dayton area most of my life. I have shown work in galleries around Ohio, Indiana, Denver and Chicago. I have been chosen on multiple occasions to create murals for festivals all over the Midwest. I specialize in acrylic painting but also dabble in sculpture work, fiber arts, and digital art."",""decorations"":[]}}],""paragraphData"":{""textStyle"":{""textAlignment"":""AUTO""},""indentation"":0}}],""metadata"":{""version"":1,""createdTimestamp"":""2022-12-19T17:56:18.279Z"",""updatedTimestamp"":""2022-12-19T17:56:18.279Z"",""id"":""35ec76a2-f874-4cb1-ad73-7d9d9c2a1b41""},""documentStyle"":{}}","My creative endeavor revolves around the exploration of sensory perception and the boundaries of reality. Through my art, I strive to evoke a state of hallucination without the use of drugs, inviting viewers to embark on a journey of visual transcendence. By employing various mediums and techniques, I aim to challenge conventional notions of perception and awaken a heightened sense of awareness within the observer. Each piece serves as a portal to an alternate reality, where the mind is free to roam and imagination knows no bounds.","https://www.facebook.com/technocolorart","https://www.instagram.com/technocolorart","https://www.technocolorart.com",,"[{""description"":"""",""slug"":""648eff_4a0a78b426544a739f8ce29d36b721a0~mv2.jpeg"",""alt"":"""",""src"":""wix:image://v1/648eff_4a0a78b426544a739f8ce29d36b721a0~mv2.jpeg/IMG_2205.jpeg#originWidth=2891&originHeight=2889"",""title"":""IMG_2205.jpeg"",""type"":""image"",""settings"":{""width"":2891,""height"":2889,""focalPoint"":[0.5,0.5]}}]","Groovy","24”x24”","Acrylic","wix:image://v1/648eff_3b65ce680a4c43158d20a9704a3ae734~mv2.jpeg/9ABDE73B-B0E7-42AB-ACF6-464073A4CAB1.jpeg#originWidth=750&originHeight=1333","/artist/lindsey-tribelhorn","/artists/","4992043c-8f5e-49c2-8eb7-953d06d15bd3",2024-04-25T14:37:59Z,2024-04-25T14:37:59Z,"648eff38-1300-4400-b20a-ee65209af597"
