"Name","Lastname","Email","Medium","Phone","Bio","Artist Statement","Facebook","Instagram","Website","Website2","Sample Piece","Piece Title","Piece Size","Piece Medium","Photo","Artists (Item)","Artist (List)","ID","Created Date","Updated Date","Owner"
"Kathleen Caffrey","Caffrey","caffreyka@gmail.com","[""Drawing"",""Fabric Arts"",""Painting"",""Printmaking""]",,"{""nodes"":[{""type"":""PARAGRAPH"",""id"":""foo"",""nodes"":[{""type"":""TEXT"",""id"":"""",""nodes"":[],""textData"":{""text"":""Like many people, I came into art during Covid. I liken the experience to a very french looking Koolaid man in effect. The drive to create and draw and paint was immediate and nonoptional."",""decorations"":[]}}],""paragraphData"":{""textStyle"":{""textAlignment"":""AUTO""},""indentation"":0}},{""type"":""PARAGRAPH"",""id"":""njng6124"",""nodes"":[{""type"":""TEXT"",""id"":"""",""nodes"":[],""textData"":{""text"":""Later, when the mania subsided, I took a breath a looked at what I was making. What the topics were and how I was showing them. Then I arrived at the name I’ve used since, Anthrosercher."",""decorations"":[]}}],""paragraphData"":{""textStyle"":{""textAlignment"":""AUTO""}}},{""type"":""PARAGRAPH"",""id"":""ucc7j136"",""nodes"":[],""paragraphData"":{""textStyle"":{""textAlignment"":""AUTO""}}},{""type"":""PARAGRAPH"",""id"":""vpngw126"",""nodes"":[{""type"":""TEXT"",""id"":"""",""nodes"":[],""textData"":{""text"":""I’ve never known a time when my overriding inspiration wasn’t curiosity. Always surrounded by history and culture my greatest joy was found in exploration, seeking perception, and wanting to understand more. I grew up in Alabama, near Civil War Sites, Bus Boycott parking lots and hanging trees that once bore strange fruit. The complications and shadows of life were ever-present. There’s a saying that anthropology majors are born and have to find their way home. I remember reading the introduction chapter of my first Anthropology textbook and feel that to be true. I had found part of my tribe."",""decorations"":[]}}],""paragraphData"":{""textStyle"":{""textAlignment"":""AUTO""}}},{""type"":""PARAGRAPH"",""id"":""zzuq5144"",""nodes"":[],""paragraphData"":{""textStyle"":{""textAlignment"":""AUTO""}}},{""type"":""PARAGRAPH"",""id"":""gzw0k128"",""nodes"":[{""type"":""TEXT"",""id"":"""",""nodes"":[],""textData"":{""text"":""Looking over my current works my story is reflected. Archaeological sites, historical references, artifacts, architecture, classical studies, forgotten techniques, and echoes of people and cultures past. Yet I also draw the courage of those who came before, who faced the challenges of their time - as well as those who claim that courage today. With courage, all things can be faced, and more than we think can be changed. There is no time without challenge."",""decorations"":[]}}],""paragraphData"":{""textStyle"":{""textAlignment"":""AUTO""}}},{""type"":""PARAGRAPH"",""id"":""g3bx3152"",""nodes"":[],""paragraphData"":{""textStyle"":{""textAlignment"":""AUTO""}}},{""type"":""PARAGRAPH"",""id"":""bsnv7130"",""nodes"":[{""type"":""TEXT"",""id"":"""",""nodes"":[],""textData"":{""text"":""Like my topics, I can’t seem to stick to a medium. There’s just too much to learn and explore to stay anywhere stagnant. I received a classic art education and have used that as a jumping-off point to explore further. With a foundation of the classics like oil, watercolors, and graphite I have added anything I can to learn and gain additional tools."",""decorations"":[]}}],""paragraphData"":{""textStyle"":{""textAlignment"":""AUTO""}}},{""type"":""PARAGRAPH"",""id"":""kzyzc160"",""nodes"":[],""paragraphData"":{""textStyle"":{""textAlignment"":""AUTO""}}},{""type"":""PARAGRAPH"",""id"":""wf0j3132"",""nodes"":[{""type"":""TEXT"",""id"":"""",""nodes"":[],""textData"":{""text"":""As time goes on I have my own times to explore, times past to inspire, and the world for new things to live through. My brushes are ready."",""decorations"":[]}}],""paragraphData"":{""textStyle"":{""textAlignment"":""AUTO""}}}],""metadata"":{""version"":1,""createdTimestamp"":""2022-12-19T17:56:18.279Z"",""updatedTimestamp"":""2022-12-19T17:56:18.279Z"",""id"":""d4b7379a-982b-41b2-8834-13b8b7ba2fe7""},""documentStyle"":{}}","Mindfulness and transformation. The world we live in is precious in the passing moments and dynamic in the shifting sands under our feet. I express my observations and moments in my own efforts to make sense of these opposing forces.

I have always been interested in techniques and methods from the past and present. I have studied historical photographic methods as well as historic drawing, painting, drafting, and methods of perspective. I have also made a point to keep an eye on new products and methods, as well as pioneers exploring joint and evolved techniques.

The past is always present, the present is always passing and the future was planted long ago. While rooted in a lifelong personal study of the Humanities and Science, human beings experience life on emotional terms. This data is transformed into experience and reaction, relationship and connection, and community and focus.

The creative fields, including art, are a means of exploring these. And in my work, I use the emotive effect of art to explore the complex reality we all daily seek to understand.","https://www.facebook.com/kathleen.caffrey/","https://www.instagram.com/anthrosercher",,,"[{""description"":"""",""slug"":""648eff_235448353e3c4446a77ee4365d2a4d0b~mv2.jpeg"",""alt"":"""",""src"":""wix:image://v1/648eff_235448353e3c4446a77ee4365d2a4d0b~mv2.jpeg/IMG_0641.jpeg#originWidth=2689&originHeight=3632"",""title"":""IMG_0641.jpeg"",""type"":""image"",""settings"":{""width"":2689,""height"":3632,""focalPoint"":[0.5,0.5]}}]","Poseidon","12x16","Multimedia on wood","wix:image://v1/648eff_4deaaf552c06482ea6c9b8379ed10fe9~mv2.jpeg/IMG_8727.jpeg#originWidth=2804&originHeight=3507","/artist/kathleen-caffrey","/artists/","c396c42b-731e-4351-a28e-b9cb661230d4",2024-03-10T20:52:00Z,2024-03-28T22:06:42Z,"648eff38-1300-4400-b20a-ee65209af597"
"Elisha Frontz","Frontz","elisha@elishafrontzart.com","[""Drawing"",""Fabric Arts"",""Painting"",""Sculpture"",""Mixed Media""]","9376235295","{""nodes"":[{""type"":""PARAGRAPH"",""id"":""foo"",""nodes"":[{""type"":""TEXT"",""id"":"""",""nodes"":[],""textData"":{""text"":""Elisha Frontz has worked as an artist and a musician in her home town of Dayton, Ohio for almost 30 years."",""decorations"":[]}}],""paragraphData"":{""textStyle"":{""textAlignment"":""AUTO""},""indentation"":0}},{""type"":""PARAGRAPH"",""id"":""1zb3j126"",""nodes"":[{""type"":""TEXT"",""id"":"""",""nodes"":[],""textData"":{""text"":""Elisha graduated with a Bachelor’s Degree in Fine Art with a concentration in sculpture from the Art Academy of Cincinnati in 2004. She has taught art classes and workshops at the Dayton Art Institute and the Contemporary Art Center in Cincinnati, Ohio, as well as private lessons."",""decorations"":[]}}],""paragraphData"":{""textStyle"":{""textAlignment"":""AUTO""}}}],""metadata"":{""version"":1,""createdTimestamp"":""2022-12-19T17:56:18.279Z"",""updatedTimestamp"":""2022-12-19T17:56:18.279Z"",""id"":""e1d0e3f0-d647-4a5d-8a45-bdca3ada5e0f""},""documentStyle"":{}}","As an artist, I am drawn to the complexity and beauty of the systems and patterns found in both the natural world and in mathematics. In my work, I explore these themes through a combination of traditional art materials and the many mediums of fiber art, using a variety of techniques to create intricate and detailed pieces that reflect the interconnectedness of all things.","https://www.facebook.com/elisha.frontz.art?mibextid=LQQJ4d","https://www.instagram.com/elishafrontzart?igsh=MXJjcmZyNDRnbTlsYQ%3D%3D&utm_source=qr","https://www.elishafrontzart.com/",,"[{""description"":"""",""slug"":""648eff_336fc6d786824f438fa7fac273814821~mv2.jpeg"",""alt"":"""",""src"":""wix:image://v1/648eff_336fc6d786824f438fa7fac273814821~mv2.jpeg/IMG_7583.jpeg#originWidth=2960&originHeight=2960"",""title"":""IMG_7583.jpeg"",""type"":""image"",""settings"":{""width"":2960,""height"":2960,""focalPoint"":[0.5,0.5]}}]","River, Bending","37” x 37” x 4”","Mixed Media","wix:image://v1/648eff_5d615a89509a4a5698eb2dfd028e84d6~mv2.jpeg/IMG_7702.jpeg#originWidth=1275&originHeight=1275","/artist/elisha-frontz","/artists/","c70b0c3d-eba3-407d-a939-af688a8f8622",2024-03-26T12:16:56Z,2024-03-28T22:05:13Z,"648eff38-1300-4400-b20a-ee65209af597"
"Rebecca Rowley","Rowley","luckyrabbitcurios@gmail.com","[""Printmaking""]","937-260-2169","{""nodes"":[{""type"":""PARAGRAPH"",""id"":""foo"",""nodes"":[{""type"":""TEXT"",""id"":"""",""nodes"":[],""textData"":{""text"":""Rebecca Rowley (Becky) is a life long resident of Beavercreek, Ohio and is a linocut print artist."",""decorations"":[]}}],""paragraphData"":{""textStyle"":{""textAlignment"":""AUTO""},""indentation"":0}},{""type"":""PARAGRAPH"",""id"":""jnt01102"",""nodes"":[{""type"":""TEXT"",""id"":"""",""nodes"":[],""textData"":{""text"":""Growing up near creeks and woodlands, she formed a relationship with the outdoors and the creatures who live there."",""decorations"":[]}}],""paragraphData"":{""textStyle"":{""textAlignment"":""AUTO""}}},{""type"":""PARAGRAPH"",""id"":""9r2fm104"",""nodes"":[{""type"":""TEXT"",""id"":"""",""nodes"":[],""textData"":{""text"":""In 2021, she was looking for an artistic outlet and in one afternoon filled with sorrow, she found it."",""decorations"":[]}}],""paragraphData"":{""textStyle"":{""textAlignment"":""AUTO""}}},{""type"":""PARAGRAPH"",""id"":""oq1t6106"",""nodes"":[{""type"":""TEXT"",""id"":"""",""nodes"":[],""textData"":{""text"":""Becky's Dad passed away on a beautiful and perfect day in September 2021. She found herself sitting on her parents front porch, waiting on a \""sign\"". In the midst of her grief, she was surrounded by Monarch butterflies. In that few minutes, she believes her Dad sent her the \""sign\"" she needed, the artistic idea to build upon."",""decorations"":[]}}],""paragraphData"":{""textStyle"":{""textAlignment"":""AUTO""}}},{""type"":""PARAGRAPH"",""id"":""ua1sr108"",""nodes"":[{""type"":""TEXT"",""id"":"""",""nodes"":[],""textData"":{""text"":""\""The Monarch and The Sun\"" was created in remembrance of her Dad. Pieces are typically created in a series of (3). The Monarch & The Sun is the only stand alone piece."",""decorations"":[]}}],""paragraphData"":{""textStyle"":{""textAlignment"":""AUTO""}}},{""type"":""PARAGRAPH"",""id"":""6dg3l110"",""nodes"":[{""type"":""TEXT"",""id"":"""",""nodes"":[],""textData"":{""text"":""When not in her home studio, Becky works for Five Rivers MetroParks in their administrative offices. She enjoys baking and gardening. When time allows, hiking and camping are on the schedule with her husband Rob and their black lab, Peaches Marie."",""decorations"":[]}}],""paragraphData"":{""textStyle"":{""textAlignment"":""AUTO""}}}],""metadata"":{""version"":1,""createdTimestamp"":""2022-12-19T17:56:18.279Z"",""updatedTimestamp"":""2022-12-19T17:56:18.279Z"",""id"":""1313044a-99b9-4e32-8ee7-c2d5f9fd57ea""},""documentStyle"":{}}","2021, I was looking for a new artist outlet. My Dad passed away in September 2021. I sat on my parents front porch while my Mom was inside saying her final, personal good byes. Suddenly, one by one, the Monarch butterflies began to appear. I knew in that moment that this was a message. I could see the image so clearly, a monarch rising with the sun. Even today, there are times that Monarchs, in photos or drawings, will come across my vision and I know that I am doing ok.

I prefer to work in ""collections of 3"". I cut linoleum on subjects that speak to my heart. Many of my block prints are over water color backgrounds. I love the way the subtle colors break through the solid ink.

I get excited when someone tells me why my art speaks to them. Connections are important and I am looking for those subtle and not so subtle connections in my work.","https://www.facebook.com/luckyrabbitcurios?mibextid=ZbWKwL","https://instagram.com/luckyrabbitcurios?igsh=YzYxdz10OTBrNzVy","https://lucky-rabbit-curios.myshopify.com",,"[{""description"":"""",""slug"":""648eff_dc3058bba8bb44558d297c0a986632d1~mv2.jpg"",""alt"":"""",""src"":""wix:image://v1/648eff_dc3058bba8bb44558d297c0a986632d1~mv2.jpg/20240320_080149.jpg#originWidth=3000&originHeight=4000"",""title"":""20240320_080149.jpg"",""type"":""image"",""settings"":{""width"":3000,""height"":4000,""focalPoint"":[0.5,0.5]}}]","The Monarch & The Sun","5"" x 7""","linoprint","wix:image://v1/648eff_fc8e6c5c02c5463386efafcebf008a99~mv2.jpg/PSX_20240229_062411.jpg#originWidth=2208&originHeight=2944","/artist/rebecca-rowley","/artists/","c7695e20-26ef-4f3b-a334-d5667c879171",2024-03-23T11:13:49Z,2024-03-28T22:05:16Z,"648eff38-1300-4400-b20a-ee65209af597"
"Yetunde Rodriguez","Rodriguez","yrdsgn@gmail.com","[""Mixed Media"",""Fabric Arts"",""Painting"",""Printmaking""]","9373679705","{""nodes"":[{""type"":""PARAGRAPH"",""id"":""foo"",""nodes"":[{""type"":""TEXT"",""id"":"""",""nodes"":[],""textData"":{""text"":""Yetunde Rodriguez is a Nigerian American Artist living in Dayton."",""decorations"":[{""type"":""COLOR"",""colorData"":{""background"":""rgb(255, 255, 255)"",""foreground"":""rgb(71, 71, 71)""}}]}}],""paragraphData"":{""textStyle"":{""textAlignment"":""AUTO""},""indentation"":0}}],""documentStyle"":{}}","Yetunde sees possibilities everywhere.","https://www.facebook.com/profile.php?id=100091340006372","https://instagram.com/yaytoonday","https://www.yetunderodriguez.com",,"[{""description"":"""",""slug"":""648eff_23ced2dabeba46db9674adc4d4584344~mv2.jpeg"",""alt"":"""",""src"":""wix:image://v1/648eff_23ced2dabeba46db9674adc4d4584344~mv2.jpeg/_.jpeg#originWidth=4032&originHeight=3024"",""title"":"""",""type"":""image"",""settings"":{""width"":4032,""height"":3024,""focalPoint"":[0.5,0.5]}}]","Dream Sequence 2: Collider","36in x 24in","Mixed Media","wix:image://v1/648eff_f782ec2f162d4906bffdcd8cfe3db9d1~mv2.jpeg/IMG_8821.jpeg#originWidth=2316&originHeight=3088","/artist/yetunde-rodriguez","/artists/","cb3e7089-9f40-4ff1-bc03-660eafc58f5a",2025-03-04T22:39:27Z,2025-03-04T22:39:27Z,"648eff38-1300-4400-b20a-ee65209af597"
"Heather Caulfield","Caulfield","heathercaulfieldart@gmail.com","[""Drawing"",""Painting""]","9379939043","{""nodes"":[{""type"":""PARAGRAPH"",""id"":""foo"",""nodes"":[{""type"":""TEXT"",""id"":"""",""nodes"":[],""textData"":{""text"":""Heather Caulfield is a soulful creative visionary Artist, Art Director, Teacher, Author, Designer and Editor. Her first love of oil painting started at 8 years old while studying painting in traditional methods with prominent painter Nancy Prophit in her studio in Detroit MI. After achieving a BFA at the Columbus College of Art and Design on full tuition scholarship, she later studied intensely with master painters such as Nelson Shanks at Studio Incamminati in Philadelphia, PA and with the great Stanley Mouse in Sonoma County, CA. She painted live at many festivals and events and was a live painter in “Ser La Muse,” a variety show of numerous entertainers performing in Northern California delivering delicious experiences including live painters, belly dancers, entertainers, live music and many muses. Her paintings have been shown in various galleries in multiple locations all across the U.S. She has designed many images and logos, seen far and wide such as licensed graphics for the Grateful Dead, flyers for music events, and screen print designs for local design houses, bands, festivals, and local companies, and designs for Urban Outfitters in Philadelphia PA. Heather has taught classes of all kinds, children and adult, at the Dayton Art Institute in Dayton, Ohio, and private painting and drawing lessons in her personal art studio. She is currently a resident artist at the Bob “Marley Natural” Dispensaries in St Thomas and St. Croix U.S.V.I. She is also currently writing and Illustrating a series of children's books. A mother to a budding artist, she continues her figurative studies while reconnecting with ancestral roots after a long strange and glorious trip."",""decorations"":[{""type"":""COLOR"",""colorData"":{""background"":""rgb(255, 255, 255)"",""foreground"":""rgb(71, 71, 71)""}}]}}],""paragraphData"":{""textStyle"":{""textAlignment"":""AUTO""},""indentation"":0}}],""metadata"":{""version"":1,""createdTimestamp"":""2022-12-19T17:56:18.279Z"",""updatedTimestamp"":""2022-12-19T17:56:18.279Z"",""id"":""6ee61c47-c0df-47b0-a47b-9a8ae9c81ab8""},""documentStyle"":{}}","My name is Heather Caulfield. I am a soulful creative visionary Artist, Art Director, Teacher, Author, Designer and Editor. I have painted since I can remember, art has always been a best friend and intuitive messenger, my paintings speak to me, sometimes years later delivering messages to my soul. My love of the renaissance era led me to study many masters such as Michaelangelo and Davinci and other classic painters. They influenced my traditional approach to painting techniques and my love of figurative works and portraiture. Now a mother to a budding artist, I continue figurative studies while reconnecting with my ancestral roots, exploring unique creative expressions ineffably and beyond. I am a spiritual dreamer and infinite conduit of pure source, downloading and documenting information from the unseen and assisting creation since birth. Lover of Nature, whimsical expression and all things mysterious. Experiencer of mystical happenings, delivering a voice for the collective to acknowledge the magic that Nature is. A spiritually charged terrestrial, deep in wonderous imagination, often caught in a daydream or away with the fairies in all delight. Forever a student, studying and seeking universal truths and divine wisdom. A Neptunian painter of innate emotion, capturing the soul on canvas, the pure essence of one’s being. I honor the infinite soul and acknowledge the infinite ONE in you!","https://facebook.com/CaulfieldART","https://instagram.com/heathercaulfield",,,"[{""description"":"""",""slug"":""648eff_b117d66d3ca240e090e46b7bb382fbc9~mv2.jpg"",""alt"":"""",""src"":""wix:image://v1/648eff_b117d66d3ca240e090e46b7bb382fbc9~mv2.jpg/_.jpg#originWidth=1080&originHeight=1242"",""title"":"""",""type"":""image"",""settings"":{""width"":1080,""height"":1242,""focalPoint"":[0.5,0.5]}}]","WhyWar","18x24","Oils and Acrylics","wix:image://v1/648eff_0593fed81b65488aa1b2ae675ab2cbb8~mv2.jpg/917487_854291438015434_616917952_n%20-%20Copy.jpg#originWidth=640&originHeight=640","/artist/heather-caulfield","/artists/","cd17ce6c-ddaa-4165-8560-a67989b5ef84",2024-10-29T23:45:02Z,2024-10-29T23:45:02Z,"648eff38-1300-4400-b20a-ee65209af597"
"Jon Daugherty","Daugherty","jdaugherty@3TBrands.com","[""Drawing"",""Painting"",""Ceramics"",""Sculpture""]","9372602630","{""nodes"":[{""type"":""PARAGRAPH"",""id"":""foo"",""nodes"":[{""type"":""TEXT"",""id"":"""",""nodes"":[],""textData"":{""text"":""Jon Daugherty is a versatile and accomplished individual with a rich background in both product development and the arts. Hailing from Dayton, he has spent over three decades honing his skills in the world of product design and development. His expertise lies in identifying market needs, creating innovative solutions, and building strategic partnerships to bring products to life, all while maintaining a keen focus on growth and making a retail impact."",""decorations"":[{""type"":""COLOR"",""colorData"":{""background"":""rgb(255, 255, 255)"",""foreground"":""rgb(71, 71, 71)""}}]}}],""paragraphData"":{""textStyle"":{""textAlignment"":""AUTO""},""indentation"":0}},{""type"":""PARAGRAPH"",""id"":""t49k8122"",""nodes"":[],""paragraphData"":{""textStyle"":{""textAlignment"":""AUTO""},""indentation"":0}},{""type"":""PARAGRAPH"",""id"":""mekid127"",""nodes"":[{""type"":""TEXT"",""id"":"""",""nodes"":[],""textData"":{""text"":""In addition to his professional achievements in product development, Jon is also an artist and a passionate advocate for the local arts scene. Together with his wife, Lori, he co-founded and operates Darty Art Studio & Gallery. Their mission is to create and share unique artistic expressions with the Dayton community, fostering a deeper love for art and creativity. Jon's artistic pursuits span multiple mediums, including Soft Pastel painting and his distinctive paper tube sculptures, which have garnered attention for their whimsical and inventive nature."",""decorations"":[{""type"":""COLOR"",""colorData"":{""background"":""rgb(255, 255, 255)"",""foreground"":""rgb(71, 71, 71)""}}]}}],""paragraphData"":{""textStyle"":{""textAlignment"":""AUTO""},""indentation"":0}},{""type"":""PARAGRAPH"",""id"":""9qbw5145"",""nodes"":[],""paragraphData"":{""textStyle"":{""textAlignment"":""AUTO""},""indentation"":0}},{""type"":""PARAGRAPH"",""id"":""uegpc149"",""nodes"":[{""type"":""TEXT"",""id"":"""",""nodes"":[],""textData"":{""text"":""Jon’s commitment to art extends beyond the studio, as he has contributed to numerous community-based collaborative art installations. Notable projects include the Wag Town Benches, located throughout downtown Dayton, and the Linden Heights, Highland Park, and Free Library tree sculptures, all of which have added beauty and a sense of connection to the community. Through his work, Jon strives to make art accessible, enjoyable, and impactful for everyone."",""decorations"":[{""type"":""COLOR"",""colorData"":{""background"":""rgb(255, 255, 255)"",""foreground"":""rgb(71, 71, 71)""}}]}}],""paragraphData"":{""textStyle"":{""textAlignment"":""AUTO""},""indentation"":0}}],""metadata"":{""version"":1,""createdTimestamp"":""2022-12-19T17:56:18.279Z"",""updatedTimestamp"":""2022-12-19T17:56:18.279Z"",""id"":""26ff9a36-d5ca-47d1-91dc-8195574d4c11""},""documentStyle"":{}}","I make stuff up.","https://facebook.com/dartyartdayton",,"https://www.dartyart.com/",,"[{""description"":"""",""slug"":""648eff_f3427a3ced4e443885c7b6c7f2ce396a~mv2.jpeg"",""alt"":"""",""src"":""wix:image://v1/648eff_f3427a3ced4e443885c7b6c7f2ce396a~mv2.jpeg/_.jpeg#originWidth=1595&originHeight=1595"",""title"":"""",""type"":""image"",""settings"":{""width"":1595,""height"":1595,""focalPoint"":[0.5,0.5]}}]","Drive By","8 in X 8 in","Soft Pastel","wix:image://v1/648eff_7128571de99049f78083fa7c6a4ddda6~mv2.jpeg/IMG_5951.jpeg#originWidth=3024&originHeight=4032","/artist/jon-daugherty","/artists/","d5de3e1c-c035-403f-bad1-41ad96a7620a",2024-12-11T21:15:27Z,2024-12-11T21:15:27Z,"648eff38-1300-4400-b20a-ee65209af597"
